MCQ,Choices,Correct
What is machine learning?,a: A field of study in artificial intelligence concerned with the development and study of statistical algorithms | b: A field of study in biology concerned with plant life | c: A field of study in psychology concerned with human behavior | d: A field of study in chemistry concerned with chemical reactions,a
Who coined the term 'machine learning'?,a: Arthur Samuel | b: Donald Hebb | c: Walter Pitts | d: Warren McCulloch,a
What is the synonym used for machine learning in the past?,a: Artificial intelligence | b: Self-teaching computers | c: Computer vision | d: Natural language processing,b
What is the purpose of machine learning in classifying data?,a: To make predictions for future outcomes | b: To develop statistical algorithms | c: To analyze sonar signals | d: To classify data based on models,d
Which book by Tom M. Mitchell provides a formal definition of the algorithms studied in machine learning?,a: The Organization of Behavior | b: Learning Machines | c: Computing Machinery and Intelligence | d: Machine Learning,d
